{
  "schemaVersion": "jstack.launch.controls.v2",
  "catalogVersion": "2.0.0",
  "sourceProvenance": {
    "sources": [
      {
        "sourceUrl": "https://nicoburkart.notion.site/e6e88fff5ddf48a09248e2c8368445d1?v=3a293082ae3e81d0b778000c94c436d0&p=3a493082ae3e819bb4f0d4e52c1cc446&pm=s",
        "reviewedAt": "2026-07-22",
        "purpose": "Original 37-point launch checklist adapted in JStack v0.8."
      },
      {
        "sourceUrl": "https://x.com/PrajwalTomar_/status/2080974596392837123",
        "reviewedAt": "2026-07-26",
        "purpose": "Security, cost, data-governance, and scanner gap analysis for Launch Assurance v2."
      }
    ],
    "adaptationNotice": "JStack converts source checklist concerns into provider-neutral, risk-tiered engineering controls. Product names, fixed thresholds, legal generalizations, and unsupported guarantees are not copied as policy."
  },
  "surfaces": [
    {
      "id": "core",
      "description": "Every production software change, including services without a public browser surface.",
      "riskFloor": "low"
    },
    {
      "id": "public-web",
      "description": "An internet-reachable website, application, API, or documentation surface.",
      "riskFloor": "medium"
    },
    {
      "id": "browser-ui",
      "description": "A user interface rendered and operated in a web browser.",
      "riskFloor": "medium"
    },
    {
      "id": "authenticated",
      "description": "A surface with login, authorization, entitlements, or paywall decisions.",
      "riskFloor": "high"
    },
    {
      "id": "cookie-authenticated",
      "description": "A browser surface that authenticates state-changing requests with cookies.",
      "riskFloor": "high"
    },
    {
      "id": "database",
      "description": "A change that stores or reads application data from a database.",
      "riskFloor": "high"
    },
    {
      "id": "transactional-email",
      "description": "A product that sends signup, account, billing, or other transactional email.",
      "riskFloor": "medium"
    },
    {
      "id": "search-indexed",
      "description": "A public surface intended to be discovered through search engines.",
      "riskFloor": "low"
    },
    {
      "id": "performance-sensitive",
      "description": "A user-facing surface with an explicit latency or web-performance expectation.",
      "riskFloor": "medium"
    },
    {
      "id": "analytics",
      "description": "A product that emits analytics events or product measurement data.",
      "riskFloor": "medium"
    },
    {
      "id": "payments",
      "description": "A product that initiates, receives, or reconciles monetary transactions.",
      "riskFloor": "critical"
    },
    {
      "id": "commercial",
      "description": "A product offered to customers, subscribers, or paying users.",
      "riskFloor": "medium"
    },
    {
      "id": "tracking",
      "description": "A product using cookies, recordings, advertising, or non-essential behavioral tracking.",
      "riskFloor": "high"
    },
    {
      "id": "ai-paid-endpoints",
      "description": "An endpoint whose abuse creates meaningful AI inference cost.",
      "riskFloor": "high"
    },
    {
      "id": "regulated-data",
      "description": "A product handling financial, health, identity, or otherwise regulated data.",
      "riskFloor": "critical"
    },
    {
      "id": "public-form",
      "description": "An unauthenticated or public workflow that accepts submitted user input.",
      "riskFloor": "medium"
    },
    {
      "id": "cross-origin-api",
      "description": "A browser-consumed API intended to accept requests from one or more other origins.",
      "riskFloor": "high"
    },
    {
      "id": "untrusted-input",
      "description": "A server, worker, import, upload, webhook, or tool boundary that consumes untrusted input.",
      "riskFloor": "high"
    },
    {
      "id": "cost-bearing-endpoints",
      "description": "An endpoint whose abuse creates material vendor, storage, compute, messaging, or operational cost.",
      "riskFloor": "high"
    },
    {
      "id": "personal-data",
      "description": "A product collecting or processing identifiable personal data.",
      "riskFloor": "high"
    },
    {
      "id": "licensed-assets",
      "description": "A product shipping third-party fonts, media, datasets, models, templates, or other licensed assets.",
      "riskFloor": "medium"
    },
    {
      "id": "software-supply-chain",
      "description": "A product built from third-party packages, containers, generated code, or vendored components.",
      "riskFloor": "medium"
    }
  ],
  "riskTiers": [
    "low",
    "medium",
    "high",
    "critical"
  ],
  "riskModel": {
    "highSecurityControlsAreBlockers": true,
    "criticalRequiredControlsAreBlockers": true,
    "criticalWaiversAllowed": false,
    "independentScannerMinimumTier": "high",
    "criticalHumanReviewRequired": true
  },
  "statuses": [
    "pass",
    "fail",
    "incomplete",
    "not-applicable",
    "waived"
  ],
  "evidenceKinds": [
    "automated-test",
    "authorization-matrix",
    "browser-test",
    "code-review",
    "configuration-snapshot",
    "cost-control-report",
    "data-map",
    "datastore-probe",
    "delivery-test",
    "human-attestation",
    "http-security-report",
    "legal-document",
    "license-report",
    "manual-test",
    "monitoring-report",
    "penetration-test",
    "performance-report",
    "provider-receipt",
    "sbom",
    "security-scan"
  ],
  "artifactFormats": [
    "jstack-json",
    "sarif-2.1.0",
    "scanner-json"
  ],
  "controls": [
    {
      "id": "security-database-row-access",
      "sequence": 1,
      "category": "security",
      "title": "Enforce database row-level access boundaries",
      "objective": "Prove that anonymous and cross-tenant access cannot read or mutate protected database rows outside the intended policy.",
      "sourcePriority": "blocker",
      "gateLevel": "blocker",
      "applicability": {
        "allOf": [
          "database"
        ],
        "anyOf": []
      },
      "evidenceKinds": [
        "automated-test",
        "configuration-snapshot",
        "datastore-probe"
      ],
      "verificationMethods": [
        "Inspect effective database policies",
        "Run negative anonymous and cross-tenant access tests",
        "Record any privileged-service bypass boundary"
      ],
      "maxAgeMinutes": 1440,
      "ownerRole": "security",
      "waivable": false,
      "allowNotApplicable": false,
      "safetyNotes": "A framework setting or migration file alone is not proof that the effective production policy denies unintended access.",
      "minimumRiskTier": "low",
      "evidenceRequirements": [
        {
          "id": "effective-policy-snapshot",
          "description": "Capture the effective datastore authorization policy and every privileged bypass boundary.",
          "evidenceKinds": [
            "configuration-snapshot"
          ],
          "artifactFormats": [
            "jstack-json"
          ],
          "minimumCount": 1,
          "minimumDistinctProducers": 1,
          "minimumObservations": 1,
          "independent": false,
          "machineVerifiable": true,
          "requiredAssertions": [
            "row-policy-enforced",
            "privileged-bypass-documented"
          ],
          "appliesAtRiskTiers": [
            "low",
            "medium",
            "high",
            "critical"
          ]
        },
        {
          "id": "cross-tenant-probe-matrix",
          "description": "Exercise anonymous and cross-tenant read and write attempts against protected records.",
          "evidenceKinds": [
            "datastore-probe",
            "automated-test"
          ],
          "artifactFormats": [
            "jstack-json"
          ],
          "minimumCount": 1,
          "minimumDistinctProducers": 1,
          "minimumObservations": 4,
          "independent": false,
          "machineVerifiable": true,
          "requiredAssertions": [
            "anonymous-read-denied",
            "anonymous-write-denied",
            "cross-tenant-read-denied",
            "cross-tenant-write-denied"
          ],
          "appliesAtRiskTiers": [
            "low",
            "medium",
            "high",
            "critical"
          ]
        }
      ]
    },
    {
      "id": "security-server-side-authz",
      "sequence": 2,
      "category": "security",
      "title": "Enforce authentication and entitlements on the server",
      "objective": "Prove that protected data and actions remain inaccessible when browser checks, routes, or client state are bypassed.",
      "sourcePriority": "blocker",
      "gateLevel": "blocker",
      "applicability": {
        "allOf": [
          "authenticated"
        ],
        "anyOf": []
      },
      "evidenceKinds": [
        "automated-test",
        "authorization-matrix"
      ],
      "verificationMethods": [
        "Trace authorization at the authoritative server boundary",
        "Run unauthenticated and wrong-role negative tests",
        "Verify paywall or entitlement decisions cannot be client-forged"
      ],
      "maxAgeMinutes": 1440,
      "ownerRole": "security",
      "waivable": false,
      "allowNotApplicable": false,
      "safetyNotes": "Client-side route guards and hidden controls are usability features, not authorization evidence.",
      "minimumRiskTier": "low",
      "evidenceRequirements": [
        {
          "id": "authorization-decision-matrix",
          "description": "Exercise protected operations as unauthenticated, wrong-role, expired-session, and forged-entitlement principals.",
          "evidenceKinds": [
            "authorization-matrix",
            "automated-test"
          ],
          "artifactFormats": [
            "jstack-json"
          ],
          "minimumCount": 1,
          "minimumDistinctProducers": 1,